{
  "schema": "aml-verification-contract-snapshot/1",
  "status": "SHIPPED prototype contract snapshot",
  "snapshot_id": "aml-verifier-contract-2026-09-09-01",
  "source_repository": "https://github.com/aruintelligence/aml-core",
  "source_commit": "2dac9e2b4a6401af3718bc71a4b031bd57f358c5",
  "canonicalization": "sorted-json-v1",
  "witness_schema": "aml-witness-bundle/1",
  "cli_contract": "protocol/aml-verifier-cli.md",
  "golden_vector": "independent/python/witness-vector.json",
  "locked_paths": [
    "protocol/aml-verifier-cli.md",
    "protocol/aml-witness-bundle.schema.json",
    "protocol/aml-browser-evidence.schema.json",
    "protocol/aml-session-attestation.schema.json",
    "protocol/aml-verification-challenge.schema.json",
    "protocol/aml-verification-report.schema.json",
    "protocol/aml-verifier-manifest.schema.json",
    "protocol/aml-verifier-conformance-result.schema.json",
    "protocol/sorted-json-v1.md",
    "protocol/browser-canonicalization-vectors.json",
    "independent/python/witness-vector.json",
    "conformance/verifier-challenge.json",
    "scripts/run-verifier-conformance.mjs",
    "scripts/verify-verifier-conformance-result.mjs"
  ],
  "required_behavior": [
    "golden witness bundle passes",
    "receipt-bound mutation fails",
    "challenge mutation fails",
    "expired challenge fails",
    "conformance result binds exact external verifier challenge bytes by SHA-256",
    "conformance result binds exact golden witness-vector bytes by SHA-256",
    "archived conformance result rejects challenge, vector, case-order, verdict, or PASS-state rewriting"
  ],
  "claim_boundary": "This snapshot identifies an exact project-defined verifier and conformance-evidence contract by immutable Git commit and path set. It does not establish standards-body ratification, certification, implementation independence, trustworthiness, safety, ethics, legal compliance, or external adoption."
}
